{
  "$schema": "https://json-schema.org/draft/2020-12/schema",
  "$id": "siso:actionist-builder:block-contract:v0",
  "title": "Block Contract v0",
  "description": "A harvested repo/subsystem/component normalized into an installable building block for the Actionist Builder. Formalizes SISO/design/BLOCK-FRAMEWORK.md. v0 = draft for the hand-conversion pilot; expect breaking changes until one real block has passed admission.",
  "type": "object",
  "required": ["id", "kind", "provenance", "stack_contract", "provides", "eval"],
  "additionalProperties": false,
  "properties": {
    "id": {
      "type": "string",
      "description": "Namespaced, versioned block id",
      "pattern": "^[a-z0-9-]+/[a-z0-9-]+@\\d+\\.\\d+\\.\\d+$",
      "examples": ["siso/admin-dashboard-shell@0.1.0"]
    },
    "kind": {
      "enum": ["scaffold", "feature", "component", "theme", "integration", "schema-pattern"],
      "description": "scaffold = app shell a build starts from; feature = vertical slice (routes+schema+UI); component = UI unit (shadcn-registry shaped); theme = token set only; integration = external-service adapter behind an interface; schema-pattern = reusable data model + migrations"
    },
    "provenance": {
      "type": "object",
      "description": "Non-negotiable. Harvest-protocol rules apply: MIT/Apache/BSD/ISC harvestable; GPL/AGPL reference-only (must not appear here as a block); unlicensed = summarize-don't-copy.",
      "required": ["source_url", "commit_sha", "license", "harvested_at"],
      "additionalProperties": false,
      "properties": {
        "source_url": { "type": "string", "format": "uri" },
        "commit_sha": { "type": "string", "pattern": "^[0-9a-f]{7,40}$" },
        "license": { "enum": ["MIT", "Apache-2.0", "BSD-2-Clause", "BSD-3-Clause", "ISC", "first-party"] },
        "copyright": { "type": "string", "description": "Original copyright line(s), preserved verbatim" },
        "harvested_at": { "type": "string", "format": "date" },
        "adaptation_log": {
          "type": "array",
          "description": "Every transform applied during extract/standardize, in order. This log from the hand pilot becomes the automation spec.",
          "items": {
            "type": "object",
            "required": ["step", "description"],
            "additionalProperties": false,
            "properties": {
              "step": { "enum": ["extract", "rename", "detach-wiring", "db-normalize", "tokenize-styles", "interface-swap", "other"] },
              "description": { "type": "string" },
              "automated": { "type": "boolean", "default": false }
            }
          }
        },
        "harvest_score": {
          "type": "integer", "minimum": 0, "maximum": 26,
          "description": "26-point candidate score from AutoSaaS code-harvest-protocol"
        }
      }
    },
    "stack_contract": {
      "type": "object",
      "description": "What the block assumes about its host. Composition is only legal between blocks whose stack_contracts unify.",
      "required": ["runtime", "styling", "data"],
      "additionalProperties": false,
      "properties": {
        "runtime": {
          "type": "array", "minItems": 1,
          "items": { "type": "string", "pattern": "^[a-z0-9@/.-]+@[0-9]+(\\.[0-9x]+)*$" },
          "examples": [["nextjs@15", "react@19"]]
        },
        "styling": {
          "type": "object",
          "required": ["system"],
          "additionalProperties": false,
          "properties": {
            "system": { "const": "tailwind+css-vars", "description": "v0 admits exactly one styling system. All color/space/type values must resolve through var(--*) token slots — hardcoded values fail admission." },
            "component_library": { "type": "string", "examples": ["shadcn"] }
          }
        },
        "data": {
          "type": "object",
          "description": "THE standardization bet: one dialect (Postgres), one ORM per registry generation.",
          "required": ["dialect", "orm"],
          "additionalProperties": false,
          "properties": {
            "dialect": { "const": "postgres" },
            "orm": { "enum": ["drizzle", "prisma"] },
            "tables_owned": {
              "type": "array", "items": { "type": "string" },
              "description": "Tables this block's migrations create. Two blocks owning the same table cannot co-install."
            },
            "tables_read": { "type": "array", "items": { "type": "string" } }
          }
        },
        "auth_interface": {
          "enum": ["none", "session", "jwt"],
          "default": "none",
          "description": "Blocks call interface-shaped hooks (auth.getUser()), never a provider SDK directly"
        },
        "interfaces_required": {
          "type": "array",
          "description": "Non-auth interface-shaped deps the host must bind (billing, storage, email, ...)",
          "items": { "enum": ["billing", "storage", "email", "analytics", "queue", "ai"] }
        }
      }
    },
    "provides": {
      "type": "object",
      "description": "What the block exports to the assembled app.",
      "additionalProperties": false,
      "properties": {
        "routes": {
          "type": "array",
          "items": {
            "type": "object",
            "required": ["path"],
            "additionalProperties": false,
            "properties": {
              "path": { "type": "string", "pattern": "^/" },
              "kind": { "enum": ["page", "layout", "api"] },
              "auth_required": { "type": "boolean", "default": false }
            }
          }
        },
        "components": {
          "type": "array",
          "description": "shadcn-registry-shaped entries: name + files + registry deps",
          "items": {
            "type": "object",
            "required": ["name", "files"],
            "additionalProperties": false,
            "properties": {
              "name": { "type": "string" },
              "files": { "type": "array", "minItems": 1, "items": { "type": "string" } },
              "registry_dependencies": { "type": "array", "items": { "type": "string" } }
            }
          }
        },
        "migrations": {
          "type": "array", "items": { "type": "string" },
          "description": "Ordered Postgres migration file paths within the block"
        },
        "env_vars": {
          "type": "array",
          "items": {
            "type": "object",
            "required": ["name"],
            "additionalProperties": false,
            "properties": {
              "name": { "type": "string", "pattern": "^[A-Z][A-Z0-9_]*$" },
              "required": { "type": "boolean", "default": true },
              "description": { "type": "string" }
            }
          }
        },
        "events": {
          "type": "array", "items": { "type": "string" },
          "description": "Event names this block emits (for cross-block wiring)"
        }
      }
    },
    "requires": {
      "type": "array",
      "description": "Block dependency edges, by id pattern (version range allowed)",
      "items": { "type": "string" }
    },
    "tokens_consumed": {
      "type": "array",
      "description": "Design-token slots this block reads. The image-gen loop (P2) writes these; the block must render correctly under ANY value assignment.",
      "items": { "type": "string", "pattern": "^(color|space|type|radius|shadow|layout)\\." }
    },
    "eval": {
      "type": "object",
      "description": "Every block ships its own proof. No unproven blocks in the registry.",
      "required": ["build_cmd", "smoke_test"],
      "additionalProperties": false,
      "properties": {
        "build_cmd": { "type": "string", "examples": ["npm run build"] },
        "smoke_test": { "type": "string", "description": "Command that exercises the block inside the base scaffold; exit 0 = pass" },
        "screenshot_baseline": { "type": "string", "description": "Path to baseline image for screenshot-diff gate" },
        "admission": {
          "type": "object",
          "description": "Filled by the registry at admission time, not by the harvester",
          "additionalProperties": false,
          "properties": {
            "admitted_at": { "type": "string", "format": "date-time" },
            "scaffold_tested_against": { "type": "string", "description": "scaffold block id" },
            "license_scan": { "enum": ["clean", "flagged"] }
          }
        }
      }
    }
  }
}
